{
  "$ref": "#/definitions/habilidades",
  "definitions": {
    "habilidades": {
      "type": "object",
      "properties": {
        "perfis": {
          "type": "array",
          "items": {
            "type": "string"
          }
        },
        "categoria": {
          "type": "string"
        },
        "porcentagem": {
          "type": "number",
          "minimum": 0,
          "maximum": 100
        },
        "cor": {
          "type": "string",
          "pattern": "^#[\\da-fA-F]{6}$"
        },
        "itens": {
          "type": "array",
          "items": {
            "type": "object",
            "properties": {
              "subcategoria": {
                "type": "string"
              },
              "detalhes": {
                "type": "array",
                "items": {
                  "type": "string"
                }
              }
            },
            "required": [
              "subcategoria",
              "detalhes"
            ],
            "additionalProperties": false
          }
        },
        "$schema": {
          "type": "string"
        }
      },
      "required": [
        "perfis",
        "categoria",
        "porcentagem",
        "cor",
        "itens"
      ],
      "additionalProperties": false
    }
  },
  "$schema": "http://json-schema.org/draft-07/schema#"
}